hadm_id,ground_truth_icd,ground_truth_version,ground_truth_desc,changes_made,changes_count,original_icd_pred,original_pred_desc,baseline_sim,baseline_correct,perturbed_icd_pred,icd_codes_differ,suspicious_drift,semantic_similarity
24120244,I132,10,"Hypertensive heart and chronic kidney disease with heart failure and with stage 5 chronic kidney disease, or end stage renal disease","B12 -> TNFAIP1 [UMLS] | acute dialysis -> Acute dialysis program [UMLS] | Dr. -> Human leukocyte antigen DR [UMLS] | management -> Managements, Disease [UMLS] | Cardiology -> Card [UMLS] | transferred -> Delivery [UMLS] | impaired -> Impairment [UMLS] | palpation -> Palpation - action [UMLS] | years -> year [UMLS] | breath -> Exhaled gas [UMLS] | Associated with -> Associated [UMLS] | sharp -> Sharp sensation quality [UMLS] | hypertension -> HYPERTENSIVE DISEASE [UMLS] | HPI -> History of present illness [UMLS]",14,I21.0,Acute Myocardial Infarction,0.8709691762924194,True,I21.0,False,False,0.9970291256904602
23271725,56081,9,Intestinal or peritoneal adhesions with obstruction (postoperative) (postinfection),bowel movements -> Bowel action [UMLS] | decision -> Call [UMLS] | paucity -> Paucity of peroxisomes [UMLS] | film -> Film Dose Form [UMLS] | ileum -> Ileal structure [UMLS] | situation -> Case [UMLS] | paucity -> Paucity of peroxisomes [UMLS] | dilated -> Ectatic [UMLS] | woman -> Girls [UMLS],9,K56.9,Acute Pancreatitis,0.8874907493591309,True,K56.9,False,False,0.9985706210136414
22124877,64241,9,"Mild or unspecified pre-eclampsia, delivered, with or without mention of antepartum condition",SHe -> Adnfle [UMLS] | active labor -> Normal labor [UMLS] | morning -> om - omni mane [UMLS] | HPI -> History of present illness [UMLS],4,O15.9,Eclampsia without convulsions,0.9146180152893066,True,O15.9,False,False,0.9835278987884521
28588783,V5811,9,Encounter for antineoplastic chemotherapy,"brushing -> Brushing, function [UMLS] | myasthenia -> Fatigable weakness [UMLS] | dose -> Dosages [UMLS] | methotrexate -> Amethopterin [UMLS] | ROS -> ROS1 wt Allele [UMLS] | hives -> Urticaria [UMLS] | dexamethasone -> Hexadecadrol [UMLS] | stopped -> To be stopped [UMLS] | methotrexate -> Amethopterin [UMLS]",9,C91.9,Malignant Mucinous Neoplasm,0.8583308458328247,True,C88.9,True,False,0.9974806308746338
20269623,K5730,10,Diverticulosis of large intestine without perforation or abscess without bleeding,Decision -> Call [UMLS] | hematemesis -> Hematemeses [UMLS] | nausea -> Nausea:PrThr:Pt:^Patient:Ord [UMLS] | BMs -> Oral Dysesthesia [UMLS] | diagnosed -> Diagnoses [UMLS],5,K92.9,Other specified disorders,0.8666032552719116,True,K92.9,False,False,0.9906305074691772
23639462,44021,9,Atherosclerosis of native arteries of the extremities with intermittent claudication,,0,I69.359,Traumatic subdural hematoma,0.8478952050209045,True,,True,True,1.0
25802941,5722,9,Hepatic encephalopathy,,0,,,0.7721697688102722,True,,False,False,0.9999996423721313
21758486,99682,9,Complications of transplanted liver,hyperglycemic -> Hyperglycemic Mouse [UMLS] | creatinine -> Creatinine measurement [UMLS] | follow up -> Follow-up [UMLS] | weight loss -> Weight Reduction [UMLS],4,K85.8,Other specified gastritis,0.7565542459487915,True,K76.6,True,False,0.9987279176712036
